Week,Date,Name,Article Title,Article Link,Twitter Handle,MM Tweet,Key Words
173,"February 20, 2023",Ileana A. Callejas,Effect of COVID-19 Anthropause on Water Clarity in the Belize Coastal Lagoon,Frontiers in Marine Science,@IleanaCallejas,Callejas 2021,"diffuse attenuation coefficient, moderate resolution imaging spectroradiometer, remote sensing, water quality, marine traffic, Belize Barrier Reef Reserve System, water clarity"
174,"February 27, 2023",Mary Joy Buitre,The Mangrove Forests Change and Impacts from Tropical Cyclones in the Philippines Using Time Series Satellite Imagery,MDPI Remote Sensing,@Joyee_Twenty5,Buitre 2019,"comparative analysis, mangroves, Philippines, landscape metrics"
175,"March 13, 2023",Dr. Karen Joyce,Discovering Inclusivity in Remote Sensing: Leaving No One Behind,Frontiers in Remote Sensing,@DrKJoyce,Joyce 2022,"diversity, equity, inclusion, remote sensing, editorial boards, publications"
176,"May 1, 2023",Dr. Ursa Kanjir,Vessel detection and classification from spaceborne optical images: A literature survey,Remote Sensing of Environment,@OrsoMajor,Kanjir 2018,"vessel detection, vessel classification, sea target detection, object recognition, optical satellite data, maritime domain awareness"
177,"May 15, 2023",Dr. Ana Stritih,Alternative states in the structure of mountain forests across the Alps and the role of disturbance and recovery,Landscape Ecology,@AnaStritih,Stritih 2023,"mountain forests,GEDI, disturbance, basins of attraction, recovery"
181,"June 13, 2023",Mari Trix Estomata,Mapping of Forest Cover Extent and Change in the Philippines Using Decision Tree Classification on ALOS-½ PALSAR-½ Mosaic Data,Proceedings of the 40th Asian Conference on Remote Sensing),@Trixie_EA,Estomata_2019,"L-Band SAR, REDD+, Unbiased Area Estimation, Multi-Temporal Speckle Filtering"
183,"July 31, 2023",Sona Guliyeva,Comparative Analysis of Machine Learning Algorithms for Crop Mapping Based on Azersky Satellite Images,ICAIAME 2022: 4th International Conference on Artificial Intelligence and Applied Mathematics in Engineering,@SonaGuliyeva_15,Guliyeva 2023,"Remote Sensing, Deep Learning, Azersky, Crop Map, GEE"
